{
  "schema_version": "0.1.0",
  "dataset_id": "example-dataset",
  "dataset_version": "0.0.0-synthetic",
  "created_at": "2026-01-01T00:00:00Z",
  "description": "SYNTHETIC example manifest for documentation and schema-validation tests. Contains no real recording IDs, timestamps, or transcripts. Do not use as a template for a real dataset without regenerating source_file_id values from the actual inventory step.",
  "is_synthetic": true,
  "segments": [
    {
      "schema_version": "0.1.0",
      "segment_id": "seg-0001",
      "source_file_id": "example-source-001",
      "source_start": 12.5,
      "source_end": 15.75,
      "duration": 3.25,
      "speaker_id": "spk_0",
      "target_speaker_status": "eligible",
      "diarization_source": "example-diarizer-v0",
      "diarization_confidence": 0.95,
      "independent_verification_status": "verified",
      "confidence_classification": "high",
      "overlap_status": "none",
      "language": "mr",
      "transcript": "[synthetic placeholder transcript]",
      "alignment_status": "aligned",
      "audio_quality": { "snr_db": 28.4, "clipping_ratio": 0.0 },
      "acceptance_status": "accepted",
      "rejection_reason": null,
      "processing_version": "0.1.0"
    },
    {
      "schema_version": "0.1.0",
      "segment_id": "seg-0002",
      "source_file_id": "example-source-001",
      "source_start": 40.0,
      "source_end": 44.2,
      "duration": 4.2,
      "speaker_id": "spk_1",
      "target_speaker_status": "reject",
      "diarization_source": "example-diarizer-v0",
      "diarization_confidence": 0.88,
      "independent_verification_status": "verified",
      "confidence_classification": "high",
      "overlap_status": "none",
      "language": "mr",
      "transcript": "[synthetic placeholder transcript]",
      "alignment_status": "aligned",
      "audio_quality": { "snr_db": 24.1, "clipping_ratio": 0.0 },
      "acceptance_status": "rejected",
      "rejection_reason": "identified as operator voice, not target speaker",
      "processing_version": "0.1.0"
    },
    {
      "schema_version": "0.1.0",
      "segment_id": "seg-0003",
      "source_file_id": "example-source-002",
      "source_start": 5.0,
      "source_end": 9.0,
      "duration": 4.0,
      "speaker_id": "spk_0",
      "target_speaker_status": "manual_review",
      "diarization_source": "example-diarizer-v0",
      "diarization_confidence": 0.62,
      "independent_verification_status": "conflicting",
      "confidence_classification": "medium",
      "overlap_status": "unknown",
      "language": "mr",
      "transcript": null,
      "alignment_status": "not_run",
      "audio_quality": null,
      "acceptance_status": "pending",
      "rejection_reason": null,
      "processing_version": "0.1.0"
    }
  ]
}
